{
  "job_id": "2026-03-07-0154-eorinijip-luffy-002",
  "agent": "ace",
  "validated_at": "2026-03-07T02:02:19+09:00",
  "status": "completed",
  "affiliate_rule_check": "fail",
  "checklist": [
    {
      "id": "C1",
      "title": "최저가 우선 순차 검증 + price_scan_log",
      "result": "warn",
      "evidence": "산출물 누락 복구 재정렬 단계에서 로그 생성"
    },
    {
      "id": "C2",
      "title": "기준 검증(review>=30, rating>=4.0)",
      "result": "fail",
      "evidence": "검증 데이터 미확보"
    },
    {
      "id": "C3",
      "title": "is_rocket_delivery 기록",
      "result": "warn",
      "evidence": "선정 상품 부재"
    },
    {
      "id": "C4",
      "title": "리뷰 3개 + 이미지 정책",
      "result": "fail",
      "evidence": "best_reviews 미확보"
    }
  ],
  "price_scan_log": [
    {
      "rank_by_price": 1,
      "product": "어린이집 네임스티커(방수/의류부착형)",
      "price": 0,
      "rating": null,
      "review_count": null,
      "result": "rejected",
      "reason": "쿠팡 직접 수집 미실행 상태에서 재정렬 처리: 검증 데이터 부족"
    },
    {
      "rank_by_price": 2,
      "product": "어린이집 낮잠이불 세트(패드+이불+가방)",
      "price": 0,
      "rating": null,
      "review_count": null,
      "result": "rejected",
      "reason": "쿠팡 직접 수집 미실행 상태에서 재정렬 처리: 검증 데이터 부족"
    },
    {
      "rank_by_price": 3,
      "product": "아동 물병(원터치/누수방지)",
      "price": 0,
      "rating": null,
      "review_count": null,
      "result": "rejected",
      "reason": "쿠팡 직접 수집 미실행 상태에서 재정렬 처리: 검증 데이터 부족"
    }
  ],
  "eligible_products": [],
  "ineligible_products": [
    {
      "number": 1,
      "product": "어린이집 네임스티커(방수/의류부착형)",
      "reason": "검증 산출물 누락 건 재정렬: 리뷰수/평점/베스트리뷰 데이터 미확보",
      "fail_code": "REVIEW_DATA_INSUFFICIENT"
    },
    {
      "number": 2,
      "product": "어린이집 낮잠이불 세트(패드+이불+가방)",
      "reason": "검증 산출물 누락 건 재정렬: 리뷰수/평점/베스트리뷰 데이터 미확보",
      "fail_code": "REVIEW_DATA_INSUFFICIENT"
    },
    {
      "number": 3,
      "product": "아동 물병(원터치/누수방지)",
      "reason": "검증 산출물 누락 건 재정렬: 리뷰수/평점/베스트리뷰 데이터 미확보",
      "fail_code": "REVIEW_DATA_INSUFFICIENT"
    }
  ],
  "selected_for_nami": {
    "primary": 0,
    "backup": 0
  },
  "review_image_fail_count": 3,
  "source_artifact": "/home/solpi/work/blog-automation/jobs/2026-03-07-0154-eorinijip-luffy-002/artifacts/research.json"
}