{
  "job_id": "2026-03-07-0218-camping-luffy-001",
  "agent": "ace",
  "validated_at": "2026-03-07T02:35:30+09:00",
  "status": "failed_blocking",
  "affiliate_rule_check": "fail",
  "checklist": [
    {
      "id": "input_selected_loaded",
      "title": "선정 아이템 로딩",
      "result": "pass",
      "evidence": "selected_item_numbers=[1,2], payload(items)에서 rank 1/2 확인"
    },
    {
      "id": "coupang_search_executed",
      "title": "쿠팡 검색/가격 스캔 수행",
      "result": "pass",
      "evidence": "키워드 '캠핑 원터치 텐트', '캠핑 접이식 의자'로 검색 결과 수집 완료"
    },
    {
      "id": "partner_link_check",
      "title": "쿠팡 파트너스 링크 체크",
      "result": "fail",
      "evidence": "상품 원본 URL만 확보됨. 본 run에서 쿠팡 파트너스 전환 링크 생성/검증 실패(PARTNER_LINK_FAILED)"
    },
    {
      "id": "review_image_collection",
      "title": "리뷰 원문/이미지 수집",
      "result": "fail",
      "evidence": "best_reviews 3건 및 이미지 규칙 충족 데이터 미확보(REVIEW_DATA_INSUFFICIENT)"
    }
  ],
  "price_scan_log": [
    {
      "rank_by_price": 1,
      "product": "코멧 아웃도어 원터치 텐트 145x245x110cm, 베이지, 3-4인용",
      "price": 49900,
      "rating": null,
      "review_count": null,
      "result": "rejected",
      "reason": "파트너 링크 검증 실패 및 리뷰 원문/이미지 미확보"
    },
    {
      "rank_by_price": 2,
      "product": "디프캠프 아웃도어 원터치 방수 텐트 200cm x 200cm x 135cm, 블랙",
      "price": 57200,
      "rating": null,
      "review_count": null,
      "result": "rejected",
      "reason": "리뷰 원문/이미지 미확보"
    },
    {
      "rank_by_price": 3,
      "product": "코멧 한손에쏙 초경량 폴딩 체어, 블랙, 1개",
      "price": 10900,
      "rating": null,
      "review_count": null,
      "result": "rejected",
      "reason": "파트너 링크 검증 실패 및 리뷰 원문/이미지 미확보"
    },
    {
      "rank_by_price": 4,
      "product": "코멧 아웃도어 휴대용 높이조절 캠핑 스툴, 올블랙, 1개",
      "price": 17900,
      "rating": null,
      "review_count": null,
      "result": "rejected",
      "reason": "리뷰 원문/이미지 미확보"
    }
  ],
  "eligible_products": [],
  "ineligible_products": [
    {
      "number": 1,
      "product": "원터치 캠핑텐트(4인용)",
      "reason": "파트너스 링크 검증 실패 + 베스트리뷰/이미지 수집 요건 미충족",
      "fail_code": "PARTNER_LINK_FAILED"
    },
    {
      "number": 2,
      "product": "캠핑 의자(경량 접이식)",
      "reason": "베스트리뷰 3건 원문 및 이미지 수집 요건 미충족",
      "fail_code": "REVIEW_DATA_INSUFFICIENT"
    }
  ],
  "selected_for_nami": {
    "primary": 1,
    "backup": 2
  },
  "review_image_fail_count": 2,
  "source_artifact": "/home/solpi/work/agents/agent1-luffy/data/handoff/outbox/2026-03-07-0218-camping-luffy-001/2026-03-07_0220_handoff.json"
}
