{
  "job_id": "2026-03-07-0046-e2e-rehearsal-001",
  "agent": "ace",
  "validated_at": "2026-03-07T00:48:38+09:00",
  "status": "completed",
  "affiliate_rule_check": "fail",
  "checklist": [
    {
      "id": "C1",
      "title": "최저가 우선 검증 + price_scan_log",
      "result": "pass",
      "evidence": "검색 결과를 가격 오름차순으로 스캔하고 로그 기록 완료"
    },
    {
      "id": "C2",
      "title": "기준 검증(review>=30, rating>=4.0)",
      "result": "fail",
      "evidence": "Affiliate Search API 응답에 rating/review_count 미포함으로 임계치 검증 불가"
    },
    {
      "id": "C3",
      "title": "is_rocket_delivery 기록",
      "result": "warn",
      "evidence": "선정 상품 부재로 null 처리"
    },
    {
      "id": "C4",
      "title": "리뷰 3개 + 이미지 정책",
      "result": "fail",
      "evidence": "쿠팡 리뷰 엔드포인트 접근 403(Access Denied)로 원문/이미지 수집 불가"
    }
  ],
  "price_scan_log": [
    {
      "rank_by_price": 1,
      "product": "종근당건강 락토핏 골드 유산균(검색 1순위)",
      "price": 12900,
      "rating": null,
      "review_count": null,
      "result": "rejected",
      "reason": "RATING/REVIEW 데이터 부재 및 리뷰 수집 불가(403)"
    },
    {
      "rank_by_price": 2,
      "product": "종근당건강 락토핏 골드 유산균(검색 2순위)",
      "price": 13900,
      "rating": null,
      "review_count": null,
      "result": "rejected",
      "reason": "RATING/REVIEW 데이터 부재 및 리뷰 수집 불가(403)"
    }
  ],
  "eligible_products": [],
  "ineligible_products": [
    {
      "number": 1,
      "product": "종근당건강 락토핏 골드 유산균",
      "reason": "쿠팡 API/페이지 제약으로 리뷰수·평점 임계치 및 베스트리뷰 3개 원문/이미지 정책을 충족할 수 없음",
      "fail_code": "REVIEW_DATA_INSUFFICIENT"
    }
  ],
  "selected_for_nami": {
    "primary": 0,
    "backup": 0
  },
  "review_image_fail_count": 3,
  "source_artifact": "/home/solpi/work/blog-automation/jobs/2026-03-07-0046-e2e-rehearsal-001/artifacts/research.json"
}